root@comp3134-intro-to-cyber-security:~# tcpdump -r 0001.pcap
reading from file 0001.pcap, link-type EN10MB (Ethernet)
01:54:18.825661 IP comp3134-intro-to-cyber-security.ssh > bras-base-toroon020aw-grc-06-184-148-154-185.dsl.bell.ca.56163: Flags [P.], seq 296927997:296928041, ack 100723443, win 546, length 44
01:54:18.825815 IP comp3134-intro-to-cyber-security.ssh > bras-base-toroon020aw-grc-06-184-148-154-185.dsl.bell.ca.56163: Flags [P.], seq 44:152, ack 1, win 546, length 108
01:54:18.825908 IP comp3134-intro-to-cyber-security.ssh > bras-base-toroon020aw-grc-06-184-148-154-185.dsl.bell.ca.56163: Flags [P.], seq 152:188, ack 1, win 546, length 36
01:54:18.830503 IP bras-base-toroon020aw-grc-06-184-148-154-185.dsl.bell.ca.56163 > comp3134-intro-to-cyber-security.ssh: Flags [.], ack 188, win 1025, length 0
01:54:22.070057 IP comp3134-intro-to-cyber-security.ssh > 112.85.42.229.43580: Flags [F.], seq 3611601272, ack 3320457519, win 503, options [nop,nop,TS val 2701608629 ecr 3375706], length 0
01:54:22.353615 IP 112.85.42.229.43580 > comp3134-intro-to-cyber-security.ssh: Flags [R], seq 3320457519, win 0, length 0
01:54:22.353691 IP comp3134-intro-to-cyber-security > 112.85.42.229: ICMP comp3134-intro-to-cyber-security tcp port ssh unreachable, length 48
01:54:24.563829 IP scanner-10.ch1.censys-scanner.com.18399 > comp3134-intro-to-cyber-security.7774: Flags [S], seq 3069936295, win 1024, options [mss 1460], length 0
01:54:25.496910 IP scan-10.shadowserver.org.53469 > comp3134-intro-to-cyber-security.7547: Flags [S], seq 2829223622, win 65535, length 0
01:54:27.421217 IP hosting-by.4cloud.mobi.56762 > comp3134-intro-to-cyber-security.36931: Flags [S], seq 1931039832, win 1024, length 0
