root@comp3134-intro-to-cyber-security:~# tcpdump -n -i eth0
tcpdump: verbose output suppressed, use -v or -vv for full protocol decode
listening on eth0, link-type EN10MB (Ethernet), capture size 262144 bytes
01:56:01.236302 IP 143.198.34.130.22 > 184.148.154.185.56163: Flags [P.], seq 246304:246572, ack 109, win 546, length 268
01:56:01.236402 IP 143.198.34.130.22 > 184.148.154.185.56163: Flags [P.], seq 246572:246736, ack 109, win 546, length 164
01:56:01.236512 IP 143.198.34.130.22 > 184.148.154.185.56163: Flags [P.], seq 246736:246900, ack 109, win 546, length 164
01:56:01.236906 IP 143.198.34.130.22 > 184.148.154.185.56163: Flags [P.], seq 246900:247064, ack 109, win 546, length 164
01:56:01.237030 IP 143.198.34.130.22 > 184.148.154.185.56163: Flags [P.], seq 247064:247228, ack 109, win 546, length 164
01:56:01.237136 IP 143.198.34.130.22 > 184.148.154.185.56163: Flags [P.], seq 247228:247392, ack 109, win 546, length 164
01:56:01.237240 IP 143.198.34.130.22 > 184.148.154.185.56163: Flags [P.], seq 247392:247556, ack 109, win 546, length 164
01:56:01.237363 IP 143.198.34.130.22 > 184.148.154.185.56163: Flags [P.], seq 247556:247720, ack 109, win 546, length 164
01:56:01.237409 IP 184.148.154.185.56163 > 143.198.34.130.22: Flags [.], ack 242548, win 1026, length 0
01:56:01.237409 IP 184.148.154.185.56163 > 143.198.34.130.22: Flags [.], ack 244232, win 1026, length 0
01:56:01.237548 IP 143.198.34.130.22 > 184.148.154.185.56163: Flags [P.], seq 247720:248092, ack 109, win 546, length 372
01:56:01.237662 IP 143.198.34.130.22 > 184.148.154.185.56163: Flags [P.], seq 248092:248256, ack 109, win 546, length 164
01:56:01.237766 IP 143.198.34.130.22 > 184.148.154.185.56163: Flags [P.], seq 248256:248420, ack 109, win 546, length 164
01:56:01.237867 IP 143.198.34.130.22 > 184.148.154.185.56163: Flags [P.], seq 248420:248584, ack 109, win 546, length 164
01:56:01.237972 IP 143.198.34.130.22 > 184.148.154.185.56163: Flags [P.], seq 248584:248748, ack 109, win 546, length 164
01:56:01.238079 IP 143.198.34.130.22 > 184.148.154.185.56163: Flags [P.], seq 248748:248912, ack 109, win 546, length 164
01:56:01.238185 IP 143.198.34.130.22 > 184.148.154.185.56163: Flags [P.], seq 248912:249076, ack 109, win 546, length 164
01:56:01.238293 IP 143.198.34.130.22 > 184.148.154.185.56163: Flags [P.], seq 249076:249240, ack 109, win 546, length 164
01:56:01.238392 IP 184.148.154.185.56163 > 143.198.34.130.22: Flags [.], ack 244888, win 1024, length 0
01:56:01.238466 IP 143.198.34.130.22 > 184.148.154.185.56163: Flags [P.], seq 249240:249404, ack 109, win 546, length 164
01:56:01.238517 IP 143.198.34.130.22 > 184.148.154.185.56163: Flags [P.], seq 249404:249544, ack 109, win 546, length 140
01:56:01.238629 IP 143.198.34.130.22 > 184.148.154.185.56163: Flags [P.], seq 249544:249828, ack 109, win 546, length 284
01:56:01.238747 IP 143.198.34.130.22 > 184.148.154.185.56163: Flags [P.], seq 249828:249992, ack 109, win 546, length 164
01:56:01.238889 IP 143.198.34.130.22 > 184.148.154.185.56163: Flags [P.], seq 249992:250156, ack 109, win 546, length 164
01:56:01.239031 IP 143.198.34.130.22 > 184.148.154.185.56163: Flags [P.], seq 250156:250320, ack 109, win 546, length 164
01:56:01.239153 IP 143.198.34.130.22 > 184.148.154.185.56163: Flags [P.], seq 250320:250484, ack 109, win 546, length 164
01:56:01.239258 IP 143.198.34.130.22 > 184.148.154.185.56163: Flags [P.], seq 250484:250648, ack 109, win 546, length 164
01:56:01.239359 IP 143.198.34.130.22 > 184.148.154.185.56163: Flags [P.], seq 250648:250812, ack 109, win 546, length 164
01:56:01.239470 IP 143.198.34.130.22 > 184.148.154.185.56163: Flags [P.], seq 250812:250976, ack 109, win 546, length 164
^C
1683 packets captured
1687 packets received by filter
0 packets dropped by kernel
